{
  "$schema": "https://json-schema.org/draft/2020-12/schema",
  "$id": "https://ddo-code-flow/config.schema.json",
  "title": "ddo-code-flow v5 default config",
  "$comment": "v5 separates the read-only skill default config from each project's .ddo/config.json. Runtime composes defaults, project config, and run arguments in memory only.",
  "type": "object",
  "required": ["version", "base", "workflows", "atomTaskOverrides"],
  "additionalProperties": false,
  "properties": {
    "$schema": { "type": "string" },
    "version": {
      "type": "string",
      "pattern": "^[0-9]+\\.[0-9]+\\.[0-9]+$"
    },
    "base": { "$ref": "#/$defs/baseConfig" },
    "workflows": {
      "type": "object",
      "required": ["default", "selection", "items"],
      "additionalProperties": false,
      "properties": {
        "default": { "type": "string", "minLength": 1 },
        "selection": { "$ref": "#/$defs/workflowSelection" },
        "items": {
          "type": "array",
          "minItems": 1,
          "items": {
            "type": "object",
            "required": ["id", "name", "path"],
            "additionalProperties": false,
            "properties": {
              "id": { "type": "string", "pattern": "^[a-z0-9][a-z0-9-]*$" },
              "name": { "type": "string", "minLength": 1 },
              "path": { "type": "string", "minLength": 1 }
            }
          }
        }
      }
    },
    "atomTaskOverrides": { "$ref": "#/$defs/atomTaskOverrides" }
  },
  "$defs": {
    "baseConfig": {
      "type": "object",
      "required": [
        "worktreeDir",
        "defaultRunType",
        "contextPaths",
        "contextOptional",
        "respGenerator",
        "metrics"
      ],
      "additionalProperties": false,
      "properties": {
        "worktreeDir": {
          "type": "string",
          "description": "Directory that receives run worktrees. Empty string means the project parent directory."
        },
        "defaultRunType": {
          "type": "string",
          "enum": ["feat", "fix"],
          "description": "Run type used when --feature/--bugfix and text inference do not decide."
        },
        "contextPaths": {
          "type": "array",
          "items": { "type": "string", "minLength": 1 }
        },
        "contextOptional": { "type": "boolean" },
        "respGenerator": {
          "type": "object",
          "required": ["maxLength", "case", "stripStopwords"],
          "additionalProperties": false,
          "properties": {
            "maxLength": { "type": "integer", "minimum": 1, "maximum": 128 },
            "case": { "type": "string", "enum": ["kebab", "snake", "camel"] },
            "stripStopwords": { "type": "boolean" }
          }
        },
        "metrics": {
          "type": "object",
          "required": ["enabled", "provider", "failurePolicy", "report", "pricing"],
          "additionalProperties": false,
          "properties": {
            "enabled": { "type": "boolean" },
            "provider": {
              "type": "string",
              "enum": [
                "tokscale",
                "custom-command",
                "cursor-session-counter",
                "cursor-sdk"
              ]
            },
            "failurePolicy": {
              "type": "string",
              "enum": ["warn", "fail"]
            },
            "report": {
              "type": "object",
              "required": ["enabled", "path"],
              "additionalProperties": false,
              "properties": {
                "enabled": { "type": "boolean" },
                "path": { "type": "string", "minLength": 1 }
              }
            },
            "pricing": {
              "type": "object",
              "required": [
                "model",
                "inputPerMillionUsd",
                "outputPerMillionUsd"
              ],
              "additionalProperties": false,
              "properties": {
                "model": { "type": "string" },
                "inputPerMillionUsd": { "type": "number", "minimum": 0 },
                "outputPerMillionUsd": { "type": "number", "minimum": 0 }
              }
            },
            "customCommand": { "type": "string", "minLength": 1 }
          }
        }
      }
    },
    "workflowSelection": {
      "type": "object",
      "required": ["allowUserOverride", "argumentNames", "rules"],
      "additionalProperties": false,
      "properties": {
        "allowUserOverride": { "type": "boolean" },
        "argumentNames": {
          "type": "array",
          "items": { "type": "string", "minLength": 1 }
        },
        "rules": {
          "type": "array",
          "items": {
            "type": "object",
            "required": ["workflow"],
            "additionalProperties": false,
            "properties": {
              "workflow": { "type": "string", "minLength": 1 },
              "matchAny": {
                "type": "array",
                "items": { "type": "string", "minLength": 1 }
              },
              "fallback": { "type": "boolean" }
            }
          }
        }
      }
    },
    "workflowDefinition": {
      "type": "object",
      "required": ["id", "version", "name", "confirmationGates", "pipeline", "atomTaskOverrides"],
      "additionalProperties": false,
      "properties": {
        "$schema": { "type": "string" },
        "id": { "type": "string", "pattern": "^[a-z0-9][a-z0-9-]*$" },
        "version": { "type": "string", "pattern": "^[0-9]+\\.[0-9]+\\.[0-9]+$" },
        "name": { "type": "string", "minLength": 1 },
        "description": { "type": "string" },
        "descriptionEn": { "type": "string" },
        "descriptionZh": { "type": "string" },
        "confirmationGates": {
          "type": "array",
          "uniqueItems": true,
          "items": {
            "type": "string",
            "pattern": "^[a-z0-9][a-z0-9-]*$"
          }
        },
        "pipeline": {
          "type": "array",
          "items": { "$ref": "#/$defs/workflowStage" }
        },
        "atomTaskOverrides": { "$ref": "#/$defs/atomTaskOverrides" }
      }
    },
    "workflowStage": {
      "type": "object",
      "required": ["stage", "description", "atomTasks"],
      "additionalProperties": false,
      "properties": {
        "stage": {
          "type": "string",
          "pattern": "^[a-z0-9][a-z0-9-]*$"
        },
        "enabled": { "type": "boolean" },
        "description": { "type": "string", "minLength": 1 },
        "atomTasks": {
          "type": "object",
          "required": ["entry", "nodes"],
          "additionalProperties": false,
          "properties": {
            "entry": {
              "type": "array",
              "items": { "type": "string", "minLength": 1 }
            },
            "nodes": {
              "type": "object",
              "additionalProperties": { "$ref": "#/$defs/workflowNode" }
            }
          }
        }
      }
    },
    "workflowNode": {
      "type": "object",
      "required": ["next", "parallelApprove"],
      "additionalProperties": false,
      "properties": {
        "next": {
          "type": "array",
          "items": { "type": "string", "minLength": 1 }
        },
        "parallelApprove": { "type": "boolean" },
        "parallelWith": {
          "type": "array",
          "items": { "type": "string", "minLength": 1 }
        },
        "enabled": {
          "type": "boolean",
          "default": true,
          "description": "Node-level scheduling switch. Root workflow and project task overrides take precedence."
        },
        "taskRef": { "type": "string", "minLength": 1 },
        "options": {
          "type": "object",
          "additionalProperties": true
        }
      }
    },
    "atomTaskOverrides": {
      "type": "object",
      "additionalProperties": {
        "type": "object",
        "additionalProperties": {
          "anyOf": [
            { "type": "string" },
            { "type": "number" },
            { "type": "boolean" },
            { "type": "array" },
            { "type": "object" }
          ]
        },
        "description": "Task option overrides. Precedence: workflow override > project override > node option > task default.",
        "properties": {
          "enabled": { "type": "boolean" },
          "model": {
            "oneOf": [
              { "type": "string" },
              { "type": "array", "items": { "type": "string" } }
            ]
          }
        }
      }
    },
    "projectConfig": {
      "$comment": "Schema for projectRoot/.ddo/config.json. Every field is optional because runtime merges it over config.default.json in memory.",
      "type": "object",
      "additionalProperties": false,
      "properties": {
        "$schema": { "type": "string" },
        "worktreeDir": { "type": "string" },
        "defaultRunType": { "type": "string", "enum": ["feat", "fix"] },
        "contextPaths": {
          "type": "array",
          "items": { "type": "string", "minLength": 1 }
        },
        "contextOptional": { "type": "boolean" },
        "respGenerator": {
          "type": "object",
          "additionalProperties": false,
          "properties": {
            "maxLength": { "type": "integer", "minimum": 1, "maximum": 128 },
            "case": { "type": "string", "enum": ["kebab", "snake", "camel"] },
            "stripStopwords": { "type": "boolean" }
          }
        },
        "metrics": {
          "type": "object",
          "additionalProperties": true
        },
        "atomTaskOverrides": { "$ref": "#/$defs/atomTaskOverrides" }
      }
    }
  }
}
